Title By Author,Price,c
Eat That Frog ! By Brian Tracy,Rs. 400,(3)
The Lean Startup By Eric Ries,"Rs. 1,120",Nepal
"The 4-Hour Work Week: Escape The 9-5, Live Anywhere And Join The New Rich - Timothy Ferriss","Rs. 1,120",Nepal
Samaya Byawasthapan By Dr.Sudhir Dixit,Rs. 45,Rs. 50
Laxmi Nibandha Sangraha By Laxi Pdr Devkota,Rs. 270,Rs. 300
Be Rich And Happy By Robert T. Kiyosaki With Hal Zina Bennett,Rs. 560,Nepal
Set Of Six Books,"Rs. 2,260",Nepal
Zero To One By Blake Masters & Peter Thiel,Rs. 880,(1)
Mans Search For Meaning By Viktor E Frankl,Rs. 500,Nepal
We Are Displaced By Malala Yousazai,Rs. 640,Nepal
The Snowball By Warren Buffet,"Rs. 1,232",(2)
Money Master The Game By Tony Robbins,"Rs. 1,120",Nepal
Road To Success By Napoleon Hill,Rs. 440,Nepal
The Art Of Living - Norman Vincent Peale,Rs. 380,Nepal
How To Win Friends And Influence People By Dale Carnegie,Rs. 399,(6)
The Subtle Art Of Not Giving A F*Ck And Everything Is F*Cked Box Of Two Books,"Rs. 1,600",(8)
The Power Of Your Subconscious Mind + The Power Of Positive Thinking (Pack Of 2) By Joseph Murphy & Norman Vincent Peale,Rs. 700,(3)
Perfume: The Story Of A Murderer By Patrick Suskind,Rs. 800,Nepal
The Women In The Window By A.J. Finn,Rs. 640,(2)
The Magic Of Thinking Big By David J Schwartz,Rs. 800,(2)
Million Dollar Habits By Tracy Brian,Rs. 480,Nepal
How To Invest In Stock Market By Rabindra Bhattarai,Rs. 220,Nepal
Hamlet (Nepali) By William Shakespeare,Rs. 125,Nepal
Eaina By Ram Lal Joshi,Rs. 350,Nepal
The Personal Mba: A World-Class Business Education In A Single Volume By Josh Kaufman,Rs. 999,(2)
The Richest Man In Babylon - Fingerprint! By Clason George S.,Rs. 320,(1)
This Is Marketing By Seth Godin,"Rs. 1,120",(1)
Harry Potter Box Set By J.K. Rowling,"Rs. 7,777",(2)
Positive Imaging By Dr. Norman Vincent Peale,Rs. 475,Rs. 480
Grey: Fifty Shades Of Grey As Told By Christian By E.L James,Rs. 800,Nepal
The Monk Who Sold His Ferrari By Robin Sharma,Rs. 360,Rs. 380
Palpasa Cafe By Narayan Wagle,Rs. 400,Rs. 480
The First 20 Hours By Josh Kaufman,Rs. 799,Nepal
The Hate U Give By Angie Thomas,Rs. 635,Rs. 640
Set Of Six Self-Help Books (If You Read These Book You Can Change Your Life),"Rs. 1,890","Rs. 2,100"
Crazy Rich Asians By Kevin Kwan,Rs. 638,Nepal
What I Wish I Knew When I Was 20 By Tina Seelig,Rs. 800,Nepal
Corporate Chanakya By Radhakrishnan Pillai,Rs. 560,(2)
13 Keys To Success By Napoleon Hill,Rs. 320,Nepal
Mother By Maxim Gorky,Rs. 380,Rs. 400
The Boy In The Striped Pyjamas By John Boyne,Rs. 480,Nepal
The Giver Of Stars By Jojo Moyes,"Rs. 1,120",Nepal
Capital By Karl Marx,Rs. 960,(1)
Brain Power By Michael Gelb,Rs. 555,Rs. 560
Flawed By Cecelia Ahern,Rs. 560,Nepal
Get Smart By Tracy Brian,Rs. 395,Rs. 400
Stock Market In Nepal By Rabindra Bhattarai,Rs. 250,Nepal
Ps I Love You By Cecelai Ahern,Rs. 635,Rs. 640
One Of Us Is Lying By Karen M. Mcmanus,Rs. 560,Nepal
And The Mountains Echoed By Khaled Hosseini,Rs. 800,(1)
"Who Says You Can,T You Do By Daniel Chidiac",Rs. 899,Rs. 960
Mindset: How You Can Fulfill Your Potential - Dr Carol S. Dweck,Rs. 638,(2)
How Will Capitalism End? By Wolfgang Streeck,Rs. 960,Nepal
You Can Win By Shiv Khera,Rs. 640,(2)
Super Student By Olav Schewe,Rs. 640,Nepal
Sense & Sensibility By Austen Jane,Rs. 290,Rs. 320
The Perks Of Being A Wallflower - Stephen Chbosky,Rs. 478,Nepal
How To Win Friends & Influence People By Dale Carnegie,Rs. 350,(10)
Barking Up The Wrong Tree By Eric Barker,Rs. 790,Rs. 800
The Great Gatsby By F. Scott Fitzgerald,Rs. 240,Nepal
You Can Sell By Shiv Khera,Rs. 638,Nepal
International Bestseller 12 Books,"Rs. 5,555","Rs. 6,200"
A Game Of Thrones: The Story Continues By George R. R. Martin,"Rs. 6,715",Nepal
John Green Book Set,"Rs. 1,900","Rs. 1,920"
Set Of Three (The Power Of Positive Thinking + The Subtle Art + How To Stop Worrying,"Rs. 1,500",Nepal
"To All The Boys I""Ve Loved Before By Jenny Han",Rs. 880,Nepal
Sita By Amish,Rs. 640,Nepal
How To Win Friends And Influence People By Dale Carnegie,Rs. 399,(2)
Doshi Chasma By Bishweshwar Prasad Koirala,Rs. 270,Nepal
Good Economics for Hard Times By Banerjee Abhijit V.,"Rs. 1,120",Nepal
Laxmi Pdr Devkota Collection,"Rs. 1,590",Nepal
Why We Want To Be Rich By Robert T. Kiyosaki & Donald J. Trump,"Rs. 1,199","Rs. 1,280"
Luni By Laxmi Prasad Devkota,Rs. 125,Nepal
Set Of Three ( The 7 Habits + Light On Yoga + Asana Pranayama),"Rs. 2,720",Nepal
The Zahir By Paulo Coelho,Rs. 560,Nepal
The Book Thief By Markus Zusak,Rs. 880,Nepal
The Secret Of Nagas By Amish,Rs. 640,(2)
The Girl In Room 105 By Chetan Bhagat,Rs. 320,(1)
Adultery By Paulo Coelho,Rs. 480,Nepal
The Sun & Her Flowers - Rupi Kaur,Rs. 798,Nepal
All The Light We Cannot See By Anthony Doerr,Rs. 800,Nepal
Set Of Three( The Diary Of Young Girl+Mein Kampf+ Animal Farm),"Rs. 1,250",Nepal
Badalindo Nepali Samaj By Chaitanya Mishra,Rs. 315,Rs. 350
The City Son - A Novel By Samrat Upadhyay,Rs. 449,Rs. 472
The Little Prince By Antoine De Saint-Exupéry,Rs. 230,Rs. 250
The Magic By Rhanda Byrne,Rs. 800,Nepal
Animal Farm By George Orwell,Rs. 199,Rs. 250
The Complete Khaled Hosseini - Box Set,"Rs. 2,399",(1)
Diary Of A Wimpy Kid: The Third Wheel (Book 7) - The Third Wheel Jeff Kinney,Rs. 560,Nepal
Daily Inspiration By Robin Sharma,Rs. 520,Nepal
The Lord Of The Rings By J. R. R. Tolkien,"Rs. 1,600",Nepal
How To Develop Self-Confidence & Influence People By Public Speaking By Dale Carnegie,Rs. 315,Rs. 320
Himalayan Lust By Sadhguru,Rs. 499,Nepal
Turtles All The Way Down By John Green,Rs. 635,Rs. 640
Capital By Karl Marx,Rs. 960,Nepal
Chetan Bhagat Combo Of 4 Books,"Rs. 1,500","Rs. 1,600"
Sathiharu Ko Man Jitne Tatha Manishharu Lai Prabhav Parne Kala By Dale Carnegie,Rs. 225,Rs. 250
Harry Potter And The Order Of The Phoenix By J.K. Rowling,"Rs. 1,280",Nepal
P.S. I Still Love You By Jenny Han,Rs. 699,Nepal
Set Of 2 Classic Books On Money Making Mantra By Robert T. Kiyosaki & Timothy Ferriss),"Rs. 1,760",Nepal
Why Rich Are Getting Richer By Robert T. Kiyosaki,Rs. 635,Rs. 640
Harry Potter And The Half-Blood Prince By J.K. Rowling,"Rs. 1,280",Nepal
Midnights With The Mystic By Sadhguru,Rs. 478,Nepal
Set Of Three(The Power Of Your Subconscious Mind+The 7 Habits+ How To Stop Worrying),"Rs. 1,660",Nepal
The Time Machine By H.G Wells,Rs. 200,Nepal
The Golden Rules Of Success By Napoleon Hill,Rs. 640,Nepal
Self-Help Combo (The Power Of Positive Thinking & How To Win Friends And Influence People),Rs. 700,(1)
Set Of Four Books,"Rs. 3,230",Nepal
Think & Grow Rich(Hardcover) By Napoleon Hill,Rs. 640,(1)
Attitude Is Everything By Jeff Keller,Rs. 350,Nepal
Diary Of A Wimpy Kid: Hard Luck (Book 8) By Jeff Kinney,Rs. 560,Nepal
The Grid By Matt Watkinson,Rs. 799,Nepal
Set Of Three ( The Diary Of Young Girl + Siddhartha + Relativity),"Rs. 1,050",Nepal
International Bestseller 2 Books,"Rs. 1,199","Rs. 1,360"
Narendra Dai By Bishweshwar Prasad Koirala,Rs. 200,Rs. 250
How Compatible Are You? By Pease Allan Barbara,Rs. 288,Rs. 320
Set Of 2 Self Help Books By Rhonda Byrne & Mark Manson,"Rs. 2,080",Nepal
Cell By Cook Robin,Rs. 720,Rs. 800
Bishweshwar Prasad Koirala Combo 5 Books,"Rs. 1,025","Rs. 1,220"
Dekheko Desh By Mohan Mainali,Rs. 360,Rs. 400
The Tibetan Book Of Living And Dying By Rinpoche Sogyal,Rs. 800,Nepal
"Paulo Coelho : The Classic Collection Set Of 3 (The Alchemist, Eleven Minutes, Veronika Decides To Die)","Rs. 1,680",Nepal
Ram By Amish,Rs. 635,Rs. 640
Awaken The Giant Within By Antony Robbins,Rs. 960,Nepal
Sumnima By Bp Koirala,Rs. 290,Rs. 300
Grit: Why Passion And Resilience Are The Secrets To Success By Angela Duckworth,Rs. 790,Rs. 800
Naso By Guru Prasad Mainali,Rs. 300,(1)
Achive & Win Set,Rs. 935,"Rs. 1,040"
Selling You By Hill Napoleon,Rs. 555,Rs. 560
Five Point Someone By Chetan Bhagat,Rs. 390,Rs. 400
"The Power (English, Hardcover By Rhonda Byrne","Rs. 1,280",Nepal
Crime And Punishment By Fyodor Dostoyevsky,Rs. 640,(1)
The Family By Puzo Mario,Rs. 638,Nepal
Unshakeable By Tony Robbins,Rs. 900,Rs. 960
Harry Potter And The Chamber Of Secret By J.K. Rowling,Rs. 880,Nepal
"Will Grayson, Will Grayson By John Green",Rs. 635,Rs. 640
Word Power Made Easy By Norman Lewis,Rs. 400,(1)
Raja Lear By William Shakespeare (Nepali),Rs. 125,Nepal
See You At The By Zig Ziglar,Rs. 505,Rs. 560
Wonder By R.J Palacio,Rs. 635,Rs. 640
City Of Dreams By Pranaya Sjb Rana,Rs. 472,Nepal
Namra Nivedan By Jaganath Upadhaya Gurugain,Rs. 110,Rs. 125
Half Of A Yellow Sun By Chimanda Ngozi Adichie,Rs. 720,Nepal
Bridge Of Clay By Markus Zusak,"Rs. 1,025","Rs. 1,280"
The Backbenchers By Oberoi Sidharth,Rs. 180,Rs. 200
The Book Of Man By Osho,Rs. 480,Rs. 500
Outliers By Malcolm Gladwell,Rs. 960,(1)
The Miracle Morning By Hal Elrod,Rs. 560,(3)
The God Of Small Things By Arundhati Roy,Rs. 800,(1)
Lajja By Taslima Nasrin,Rs. 470,Rs. 480
Radha By Krishna Dharabasi,Rs. 599,Rs. 650
Jeet Aafnai Haatma By Swett Marden,Rs. 225,Rs. 250
Self Combo(The Richest Man In Babylon & The Leader In You),Rs. 720,Nepal
Siddhartha By Hermann Hesse,Rs. 299,Rs. 320
Kumari Prashnaharu By Durga Karki,Rs. 360,Rs. 425
Loktantra Ra Aajako Marxwaad By Chaitanya Mishra,Rs. 598,Nepal
Purple Hibiscus By Chimamanda Ngozi Adichie,Rs. 640,Nepal
Set Of Three( The Power Of Positive Thinking+The Power Of Your Subconscious Mind+Think And Grow Rich),"Rs. 1,050",Nepal
Dale Carnegie Combo Set(The Leader In You & How To Win Friends And Influence People),Rs. 798,Nepal
Little Women By Alcott Louisa May,Rs. 400,Nepal
Shortcut Your Startup,Rs. 800,Nepal
Some One Like You By Durjoy Datta & Nikita Singh,Rs. 315,Rs. 320
Gestapo By Krishna Dharabasi,Rs. 375,Nepal
Postscript By Cecelia Ahern,Rs. 640,Nepal
Unlimited Power By Robbins Tony,Rs. 960,Nepal
Siddhartha By Hermann Hesse,Rs. 225,Rs. 250
The New One Minute Manager By Ken Blanchard,Rs. 320,Nepal
The 48 Laws Of Power By Robert Greene,"Rs. 1,120",(1)
Unsafe Thinking By Sachs Jonah,Rs. 795,Rs. 800
Shakti By Rhonda Byrne,Rs. 315,Rs. 350
The Forty Rules Of Love By Elif Shafak,Rs. 800,(1)
Principles By Ray Dalio,"Rs. 1,999",(1)
Black Beauty By Anna Sewell,Rs. 350,Nepal
Nathiya By Saraswati Pratikshya,Rs. 380,Rs. 450
Frankenstein By Mary Shelley,Rs. 320,Nepal
Blue Mimosa By Parijat,Rs. 250,Nepal
Bestseller 2 Books(The Leader In You & You Can Win),"Rs. 1,040",Nepal
How To Enjoy Your Life And Your Job By Dale Carnegie,Rs. 350,Nepal
Self-Help Combo-2 (Think & Grow Rich+The Power Of Your Subconscious Mind),Rs. 700,(6)
Fire And Blood By George R.R Martin,"Rs. 1,600",Nepal
Oliver Twist By Charles Dickens,Rs. 312,Nepal
Lost Horizon By James Hilton,Rs. 800,Nepal
26 Steps To Success By Robert H. Schuller,Rs. 320,Nepal
"Why Nations Fail: The Origins Of Power, Prosperity, & Poverty - Daron Acemoglu & James A. Robinson","Rs. 1,120",Nepal
Science Of Health By Khaptad Baba,Rs. 235,Nepal
Shiv Khera Combo Set,"Rs. 1,999",Nepal
India Positive - New Essays And Selected Columns - Simple Takes On India'S Burning Issues By Chetan Bhagat,Rs. 345,Rs. 360
Start With Why By Simon Sinek,Rs. 960,Nepal
Amar Neupane Book Set,"Rs. 1,582","Rs. 1,758"
The Good Earth By Pearl S Buck,Rs. 640,Nepal
Sagarmathako Gahirai By Nawaraj Parajuli,Rs. 448,Nepal
12 Rules For Life By Jordan B. Peterson,"Rs. 1,120",(2)
Hooked By Nir Eyal,Rs. 955,Rs. 960
Kholako Geet By Upendra Subba,Rs. 225,Rs. 250
The Most Important Thing By Howard Marks,Rs. 640,(1)
Sakhee By Ramlal Joshi,Rs. 405,Rs. 450
69 Things I Wish I Knew Before Getting Married By Parul Tyagi,Rs. 216,Rs. 240
Rumi By Coleman Barks,Rs. 795,Rs. 800
Gullivers Travels By Jonathan Swift,Rs. 160,Nepal
Ghintang Ghisi Twak By Rupesh Shrestha,Rs. 285,Rs. 300
Tales From The Secret Annex By Anne Frank,Rs. 320,Nepal
Chhaughar By Raj Sargam,Rs. 350,Nepal
The White Tiger By Aravind Adiga,Rs. 640,Nepal
One Night At The Call Centre By Chetan Bhagat,Rs. 390,Rs. 400
Sumnima By Bp Koirala,Rs. 290,Rs. 300
The Ministry Of Utmost Happiness By Arundhati Roy,Rs. 720,Nepal
Yogmaya By Neelam Karki Niharika,Rs. 535,Rs. 595
Aama By Maxim Gorky,Rs. 350,Rs. 375
Megaliving By Robin Sharma,Rs. 400,Nepal
Stupid White Men: ...And Other Sorry Excuses For The State Of The Nation By Michael Moore,Rs. 720,Rs. 800
The Book Of Women By Osho,Rs. 480,Rs. 499
The Backbenchers: Extra Class By Sidhartha Oberoi,Rs. 216,Rs. 240
Bechiekee By Patricia Mccormick,Rs. 255,Rs. 300
The Source By Swart Tara,Rs. 955,Rs. 960
Siddhartha By Hesse Hermann,Rs. 320,Rs. 400
The One Plus One By Jojo Moyes,Rs. 640,Nepal
Kara By Sushila Karki,Rs. 350,Rs. 380
Man Ko Aadalat By Arjun Khadka,Rs. 315,Rs. 350
Hajar Mile Ko Bato By Narayan Dhakal,Rs. 575,Rs. 650
"Mandala Of Sherlock Holmes By Norbu, Jamyang",Rs. 864,Rs. 960
Damini Bhir By Rajan Mukarung,Rs. 420,Rs. 425
Norwegian Wood By Murakami,Rs. 960,Nepal
On The Come Up By Angie Thomas,Rs. 640,Nepal
The Godfather By Mario Puzo,Rs. 638,Nepal
The Winning Attitude By Jeff Keller,Rs. 400,(1)
Pathshala By Tirtha Gurung,Rs. 400,Nepal
Half Girlfriend By Chetan Bhagat,Rs. 390,Rs. 400
Ek Prarak Katha Aasadharan Chil By Richard Bakh,Rs. 67,Rs. 75
Self Combo(The Power Of Positive Thinking & The Leader In You),Rs. 750,Nepal
One Hundred Years Of Solitude By Gabriel Garcia Marquez,Rs. 635,Rs. 640
Dhani Haruka Panch Niyam Haru By Dr. Sudhir Dixit,Rs. 315,Rs. 350
The Wayward Daughter By Shradha Ghale,Rs. 555,Rs. 560
April Full By Krishana Acharya,Rs. 350,Nepal
Rora By Cecelia Ahern,Rs. 640,Nepal
Naya Sadak Ko Geet By Ramesh Bikal,Rs. 200,Rs. 235
Namonama: By Mahesh Thapa,Rs. 225,Rs. 250
Your Brain At Work By David Rock,Rs. 635,Rs. 640
Naya Ghar By Aahuti,Rs. 475,Rs. 525
Luna By Basudev Neupane,Rs. 350,Nepal
Quit Power: Growing Up As An Introvert In A World That Can'T Stop Talking - Susan Cain,Rs. 800,Nepal
Anuharharu By Shiram Singh Basnet,Rs. 210,Rs. 250
Aago Ka Phoolharu Hun Aago Ka Phoolharu Hoinan By Ishwor Ballav,Rs. 200,Nepal
Sallipir By Nayan Raj Pandey,Rs. 348,Nepal
Pretakalpa By Narayan Dhakal,Rs. 425,Nepal
"Babu, Aama Ra Chora By Bishweshwar Prasad Koirala",Rs. 200,Rs. 250
Sakas By Jagadish Ghimire,Rs. 375,Nepal
Fury By Salman Rushdie,Rs. 800,Nepal
Taap By Sharada Sharma,Rs. 395,Nepal
The Power Of Your Subconscious Mind By Joseph Murphy,Rs. 350,(2)
Amar Neupani Book Set(Gulabi Umer & Karodau Kasturi),Rs. 983,Nepal
Stay Free Stay Happy By Gireesh Sharma,Rs. 499,Rs. 560
1000 Kilograms Of Goa By Rohan Govenkar,Rs. 200,Rs. 240
Hajur Aamaka Katha By Amrita Lamsal,Rs. 415,Rs. 460
Parijat: Sankalit Rachanaharu By Parijat,"Rs. 3,590",Nepal
Origin By Dan Brown,Rs. 635,Rs. 640
Paris For One And Other Stories By Jojo Moyes,Rs. 640,Nepal
Bhuiyan By Yangesh,Rs. 330,Rs. 388
The Time Travelers Wife By Audrey Niffenegger,Rs. 640,Nepal
Taraju Ma Prem By Pawin Dahal,Rs. 295,Rs. 330
Brida,Rs. 525,Rs. 560
Paradise Towers By Shweta Bachchan-Nanda,Rs. 400,Nepal
Dale Carnegie'S Magic (Set Of 3 Books) By Dale Cargnie,Rs. 899,Rs. 960
The Parable Of The Pipeline By Burke Hedges,Rs. 312,Nepal
Nibandhamala By Dipak Subedi,Rs. 375,Nepal
Bircharitra By Girisawallabha Joshi,Rs. 395,Nepal
A Connecticut Yankee In King Arthurs Court By Mark Twain,Rs. 320,Nepal
Never Let Me Go By Kazuo Ishiguro,Rs. 800,Nepal
The Three Musketeers By Alexandre Dumas,Rs. 320,Nepal
The Wizard Of Oz By L. Frank Baum,Rs. 320,Nepal
Get It Done By Sam Bennett,Rs. 560,Rs. 599
Parijat Six Collection,"Rs. 1,325",Nepal
Second Chance By Robert T. Kiyosaki,Rs. 640,Nepal
Bhikhari By Mahakavi Laxmi Prasad Devkota,Rs. 70,Rs. 85
101 Nitikatha By Santa Khatiwada,Rs. 210,Rs. 235
Shikharko Dhungga By Saral Shahayatri,Rs. 395,Nepal
Bhuinkhat By Mahesh Bikram Shah,Rs. 290,Rs. 308
Hetchhakuppa By Rajan Mukarung,Rs. 295,Rs. 325
Madan Puraskar Winner Combo-( Eaina & Jiwan Kada Ki Phul),Rs. 775,Nepal
Neeti Darpan By Tilak Pdr Luitel,Rs. 475,Rs. 525
The Last Lecture: Really Achieving Your Childhood Dreams: Lessons In Living - Randy Pausch & Jeffrey Zaslow,Rs. 560,Nepal
Sikaune Saili By Khagaraj Baral,Rs. 395,Nepal
City Of Djinns A Year In Delhi By William Dalrymple,Rs. 720,Rs. 800
Yayawar By Khalil Gibran,Rs. 115,Rs. 125
Tiny Habits: The Small Changes That Change Everything By Fogg BJ,"Rs. 1,199",Nepal
Muna Madan By Laxmi Pdr Devkota,Rs. 75,Nepal
Maximum Achievement By Brian Tracy,Rs. 640,Nepal
Koreana Coffee Gaff By Narayan Wagle,Rs. 425,Rs. 495
Its Possible By Rober H. Schuller,Rs. 320,Nepal
The Little Black Book For Stunning Success By Robin Sharma,Rs. 480,Nepal
Pratigandha By Sarubhakta,Rs. 555,Rs. 599
Napoleon Hill'S Greatest Speeches,Rs. 555,Rs. 560
Swapnayatra By Arun Kumar Subedi,Rs. 550,Nepal
Teen Ghumti By Bishweshwar Prasad Koirala,Rs. 210,Rs. 250
"Babu, Aama Ra Chora By Bishweshwar Prasad Koirala",Rs. 200,Rs. 250
All The Light We Can Not See By Anthony Doerr,Rs. 800,Nepal
The Greatness Guide By Robin Sharma,Rs. 480,Nepal
Leaders Eat Last By Simon Sinek,Rs. 999,Nepal
Captivate By Vanessa Van Edwards,Rs. 790,Rs. 800
Chaliyug By Kirshna Abiral,Rs. 280,Rs. 335
We Need A Revolution By Garg Sachin,Rs. 288,Rs. 320
My Experiments With Turth By Mahatma Gandhi,Rs. 299,Rs. 380
Only Time Will Tell By Jeffrey Archer,Rs. 640,Nepal
Phatsung By Chuden,Rs. 270,Rs. 300
Amar Neupane Book Set(Gualbi umer & Seto Dharti),Rs. 923,Nepal
Jurmuraeko Bakhat By Somat Ghimire,Rs. 315,Rs. 375
Dance Dance Dance By Haruki Murakami,Rs. 800,(1)
The Go Giver By Bob Burg,Rs. 640,Nepal
Gorkhaki Chori By Prajwal Parajuli,Rs. 375,Nepal
43 Katha By Neelam Karki Niharika,Rs. 625,Rs. 695
Dukha Nirodha,Rs. 355,Rs. 395
Modiayin By Bishweshor Prasad Koirala,Rs. 150,Nepal
Aakhi Jhyal By Raman Ghimire,Rs. 235,Nepal
Shikhar Ko Dhunga By Saral Sahayatri,Rs. 395,Nepal
Lagan - Achha Rai 'Rasik,Rs. 325,Nepal
Aghori By Rajendra Parajuli,Rs. 390,Nepal
Chhamiya By Ganesh Prasad Lath,Rs. 300,Nepal
Urgenako Ghoda By Yug Pathak,Rs. 315,Rs. 350
Seemarekha By Dinesh Paudel,Rs. 250,Rs. 300
Aba Yasto Kahile Nahos By Baburam Acharya,Rs. 360,Rs. 398
Badshah Ko Autograph By Madhav Sayapatri,Rs. 300,Nepal
